{"$comment":"Schema checks shape only. COMPREHENSION-WIRING.md defines mandatory identity, byte, ancestry, inventory and existing adapter checks. No host implementation in this slice.","$defs":{"artifact":{"additionalProperties":false,"allOf":[{"if":{"properties":{"status":{"const":"ready"}}},"then":{"properties":{"kind_receipt":{"$ref":"#/$defs/reference"},"reason":{"const":"inputs_bound"},"units":{"$ref":"#/$defs/reference"}}}},{"if":{"properties":{"status":{"const":"blocked"}}},"then":{"properties":{"reason":{"enum":["missing_kind_receipt","missing_units","preserve_pending","unresolved_mapping","upstream_blocked"]}}}},{"if":{"properties":{"status":{"const":"inapplicable"}}},"then":{"properties":{"kind_receipt":{"$ref":"#/$defs/reference"},"reason":{"const":"classified_non_target"}}}}],"properties":{"artifact_sha256":{"pattern":"^[0-9a-f]{64}$(?![\\s\\S])","type":"string"},"derived_receipt":{"$ref":"#/$defs/reference"},"derived_receipt_sha256":{"pattern":"^[0-9a-f]{64}$(?![\\s\\S])","type":"string"},"kind_receipt":{"oneOf":[{"$ref":"#/$defs/reference"},{"type":"null"}]},"reason":{"enum":["inputs_bound","missing_kind_receipt","missing_units","preserve_pending","unresolved_mapping","upstream_blocked","classified_non_target"]},"status":{"enum":["ready","blocked","inapplicable"]},"units":{"oneOf":[{"$ref":"#/$defs/reference"},{"type":"null"}]}},"required":["artifact_sha256","derived_receipt_sha256","derived_receipt","kind_receipt","units","status","reason"],"type":"object"},"reference":{"additionalProperties":false,"properties":{"path":{"minLength":1,"pattern":"^[A-Za-z0-9_-]+(?:[.][A-Za-z0-9_-]+)*(?:/[A-Za-z0-9_-]+(?:[.][A-Za-z0-9_-]+)*)*$(?![\\s\\S])","type":"string"},"sha256":{"pattern":"^[0-9a-f]{64}$(?![\\s\\S])","type":"string"}},"required":["path","sha256"],"type":"object"}},"$id":"https://deflock-campaign-tool.invalid/schemas/comprehension-handoff-v1.json","$schema":"https://json-schema.org/draft/2020-12/schema","additionalProperties":false,"properties":{"activation_allowed":{"const":false},"artifacts":{"items":{"$ref":"#/$defs/artifact"},"minItems":1,"type":"array"},"canonical_copy":{"additionalProperties":false,"properties":{"path":{"minLength":1,"pattern":"^[A-Za-z0-9_-]+(?:[.][A-Za-z0-9_-]+)*(?:/[A-Za-z0-9_-]+(?:[.][A-Za-z0-9_-]+)*)*$(?![\\s\\S])","type":"string"},"schema":{"const":"canonical-ledger"},"schema_version":{"const":1,"type":"integer"},"sha256":{"pattern":"^[0-9a-f]{64}$(?![\\s\\S])","type":"string"}},"required":["path","sha256","schema","schema_version"],"type":"object"},"inventory":{"$ref":"#/$defs/reference"},"publication_ready":{"const":false},"qualified":{"const":false},"review_required":{"const":true},"rules":{"additionalProperties":false,"properties":{"path":{"minLength":1,"pattern":"^[A-Za-z0-9_-]+(?:[.][A-Za-z0-9_-]+)*(?:/[A-Za-z0-9_-]+(?:[.][A-Za-z0-9_-]+)*)*$(?![\\s\\S])","type":"string"},"sha256":{"pattern":"^[0-9a-f]{64}$(?![\\s\\S])","type":"string"},"version":{"pattern":"\\S","type":"string"}},"required":["path","sha256","version"],"type":"object"},"run_id":{"pattern":"\\S","type":"string"},"schema_version":{"const":1,"type":"integer"},"source_manifest":{"minLength":1,"pattern":"^[A-Za-z0-9_-]+(?:[.][A-Za-z0-9_-]+)*(?:/[A-Za-z0-9_-]+(?:[.][A-Za-z0-9_-]+)*)*$(?![\\s\\S])","type":"string"},"source_manifest_sha256":{"pattern":"^[0-9a-f]{64}$(?![\\s\\S])","type":"string"},"stage_promotions":{"const":0,"type":"integer"}},"required":["schema_version","run_id","source_manifest_sha256","source_manifest","inventory","canonical_copy","rules","artifacts","publication_ready","stage_promotions","review_required","qualified","activation_allowed"],"title":"Proposed comprehension file handoff v1; not detector or legal acceptance","type":"object"}
