{"activation_allowed":false,"artifacts":[{"artifact_sha256":"0000000000000000000000000000000000000000000000000000000000000001","derived_receipt":{"path":"policy-derived.json","sha256":"000000000000000000000000000000000000000000000000000000000000001d"},"derived_receipt_sha256":"000000000000000000000000000000000000000000000000000000000000001d","kind_receipt":{"path":"policy-kind.json","sha256":"0000000000000000000000000000000000000000000000000000000000000010"},"reason":"inputs_bound","status":"ready","units":{"path":"policy-units.json","sha256":"0000000000000000000000000000000000000000000000000000000000000011"}},{"artifact_sha256":"0000000000000000000000000000000000000000000000000000000000000004","derived_receipt":{"path":"retention-derived.json","sha256":"0000000000000000000000000000000000000000000000000000000000000023"},"derived_receipt_sha256":"0000000000000000000000000000000000000000000000000000000000000023","kind_receipt":{"path":"retention-kind.json","sha256":"0000000000000000000000000000000000000000000000000000000000000021"},"reason":"inputs_bound","status":"ready","units":{"path":"retention-units.json","sha256":"0000000000000000000000000000000000000000000000000000000000000016"}}],"canonical_copy":{"path":"canonical.sqlite","schema":"canonical-ledger","schema_version":1,"sha256":"0000000000000000000000000000000000000000000000000000000000000002"},"inventory":{"path":"inventory.json","sha256":"0000000000000000000000000000000000000000000000000000000000000020"},"publication_ready":false,"qualified":false,"review_required":true,"rules":{"path":"rules.json","sha256":"000000000000000000000000000000000000000000000000000000000000001b","version":"synthetic-wp6-rules-v1"},"run_id":"synthetic-producer-run-001","schema_version":1,"source_manifest":"producer-manifest.json","source_manifest_sha256":"000000000000000000000000000000000000000000000000000000000000000b","stage_promotions":0}
